{
  "$schema": "https://json-schema.org/draft/2020-12/schema",
  "$id": "https://loomtracer.local/schemas/v0/decision.accepted.json",
  "title": "decision.accepted event",
  "type": "object",
  "additionalProperties": false,
  "required": ["event_uuid", "type", "actor_id", "source", "payload"],
  "properties": {
    "event_id": { "type": ["integer", "null"], "minimum": 1 },
    "event_uuid": { "type": "string", "format": "uuid" },
    "correlation_id": { "type": ["string", "null"], "minLength": 1 },
    "causation_event_id": { "type": ["integer", "null"], "minimum": 1 },
    "type": { "const": "decision.accepted" },
    "actor_id": { "type": "string", "minLength": 1 },
    "source": { "enum": ["cli", "agent", "human", "slack", "document", "api"] },
    "source_ref": { "type": ["string", "null"], "minLength": 1 },
    "ts": { "type": ["string", "null"], "format": "date-time" },
    "payload": {
      "type": "object",
      "additionalProperties": false,
      "required": ["decision_id"],
      "dependentRequired": { "quote": ["question"], "said_in": ["quote"] },
      "properties": {
        "decision_id": { "type": "string", "minLength": 1 },
        "delegated_by": { "type": "string", "pattern": "^human:.*\\S" },
        "quote": { "type": "string", "minLength": 1 },
        "question": { "type": "string", "minLength": 1 },
        "said_in": { "type": "string", "minLength": 1 }
      }
    }
  }
}
